BDSPPatientID,annot,y_pred,NoteContent
112623695,0,1,"  Physician ***** *****       Admit date: *****/*****/*****      Discharge date: *****/*****/*****    Patient Information   ***** ***** ***** *****., ***** y.o. male (DOB = *****/*****/*****)    Home Address: ***** ***** *****  ***** ***** *****  Home Phone: *****-*****-***** (home)     What language do you prefer to use when discussing your healthcare?: English  What language do you prefer for written communication?: English    Type of Advance Care Directive(s): Health Care Proxy   Surrogate Decision ***** Name: ***** ***** (spouse)      Surrogate Decision *****'s Phone Number: (*****)*****-*****  (*****)*****-*****     Care Plan *****: *****       ***** Status at *****: Full Code (Presumed)       Discharge address same as *****: No                   Hospitalization Summary     Admission Diagnosis     Subdural hematoma             Principal Problem:    SDH (subdural hematoma)  Resolved Problems:    ***** No resolved hospital problems. *****          Surgical (OR) Procedures:   Surgeries this Admission     Past Procedures (*****/*****/***** to Today)       Date Procedures Providers     *****/*****/***** ***** ***** Bilateral *****, ***** *****                ***** (OR) Procedures:        Items for Post-Hospitalization Follow-Up:    N/A        Pending Results     None           Hospital Course   ***** PMH Alzheimer's dementia, who presents after ***** 2-3 weeks ago, now with waxing and waning mental status, head CT demonstrating largely chronic 1cm bilateral SDH with scattered hyperdense components. He was diagnosed with Alzheimer's at age ***** with positive genetics testing. His dementia has progressed gradually over time. About three weeks ago, after falling with head strike, his wife states that he has worsened in his ability to communicate and ambulate independently, now requiring full assist. He often has nonsensical speech. Today at his assisted care living facility, she visited him and he was found to be unresponsive for a couple minutes. This prompted evaluation at 
OSH where head CT was performed, demonstrating aforementioned findings.    Neurologic: Mr. ***** ***** was admitted to the Neurosurgical service on *****/*****/*****. He was started on keppra for seizure prophylaxis. He was then taken to the OR on *****/*****/***** for bilateral burr ***** for subdural hematoma evacuation by Dr. *****.  Postoperatively, the patient was extubated and transferred to the neurosciences floor for neurological surveillance. He underwent routine post-operative head CT that indicated expected post-op changes. Neurology was consulted and recommended he stay on Keppra 1gm BID, and will follow up with Neurology, which they will arrange and contact the patient/patients family.     Cardiovascular: Patient remained hemodynamically stable during the hospital course.     Pulmonary: He arrived to ***** with oxygen saturation > 95% on room air. He was intubated for the operating room and extubated post operatively without difficulty. Oxygen saturation remained >95% on RA throughout the hospital course.     FEN/Renal/GI: His diet was advanced as tolerated post-op without evidence of nausea or vomiting. He was able to void spontaneously throughout his hospital stay.    By the day of discharge on *****/*****/*****, he continued to progress, voiding good amounts of urine and tolerating a regular diet with no complaints of nausea or vomiting. His cranial wound was clean and dry without signs of infection. He was seen and evaluated by PT/OT therapies, who recommended discharge to inpatient rehab and the screening process was started.     At the time of discharge, his neurological exam was: Wide awake, alert, oriented to name. PERRL. Following commands x 4 today.             Medications   Allergies: Review of patient's allergies indicates no known allergies.    Prior to Admission Medications   Prescriptions   HYDROcodone-acetaminophen (VICODIN) 5-500 mg per tablet   Sig: Take 1-2 tablets by mouth as directed.  Q4-6H PRN pain. 
Do not drive or operate machinery while on this medication. max daily: 8 tabs   Note (*****/*****/*****): ***** Med Transfer Process    LORazepam (ATIVAN) 0.5 MG tablet   Sig: Take 1 tablet (0.5 mg total) by mouth every 6 (six) hours as needed for anxiety.   donepezil (ARICEPT) 10 MG tablet   Sig: Take 1 tablet by mouth daily.   Note (*****/*****/*****): ***** Med Transfer Process    memantine (NAMENDA) 10 MG tablet   Sig: Dose: 10 MG; Form:  Take  1 TABLET; Route: PO; Frequency: BID; Directions: Not available; Details: Dispense: 180 Tablet(s); Date: *****/*****/*****   Note (*****/*****/*****): Needs MD Verification. ***** Med Transfer Process.    memantine 21 mg *****   Sig: Dose: 21 MG; Form:  Take  1 CAP SPR 24; Route: PO; Frequency: QD; Directions: Not available; Details: Dispense: 90 Capsule(s); Date: *****/*****/*****   Note (*****/*****/*****): Needs MD Verification. ***** Med Transfer Process.    oxyCODONE-acetaminophen (PERCOCET) 5-325 mg per tablet   Sig: Take 1-2 tablets by mouth as directed.  Q4-6H PRN pain   Note (*****/*****/*****): ***** Med Transfer Process       Facility-Administered Medications: None        Discharge Medications      STOP taking these medications          HYDROcodone-acetaminophen 5-500 mg per tablet   Also known as:  VICODIN       oxyCODONE-acetaminophen 5-325 mg per tablet   Also known as:  PERCOCET         START taking these medications       Dose, Frequency, and Details    acetaminophen 325 mg tablet   Also known as:  TYLENOL    Take 2 tablets (650 mg total) by mouth every 6 (six) hours.   Last time this was given:  *****/*****/***** 12:12 PM       bisacodyl 10 mg suppository   Also known as:  DULCOLAX    Place 1 suppository (10 mg total) rectally daily as needed.   Last time this was given:  *****/*****/***** 10:29 PM       docusate sodium 100 MG capsule   Also known as:  COLACE    Take 1 capsule (100 mg total) by mouth 2 (two) times a day.   Last time this was given:  *****/*****/*****  8:48 AM       enoxaparin 40 mg/0.4 mL ***** subcutaneous syringe   Also 
known as:  LOVENOX    Inject 0.4 mL (40 mg total) under the skin daily.   Last time this was given:  *****/*****/*****  6:12 PM       levETIRAcetam 1000 MG tablet   Also known as:  KEPPRA    Take 1 tablet (1,000 mg total) by mouth 2 (two) times a day.   Last time this was given:  *****/*****/*****  8:48 AM       lisinopril 20 MG tablet   Also known as:  PRINIVIL,ZESTRIL    Take 1 tablet (20 mg total) by mouth daily.   Last time this was given:  *****/*****/*****  8:48 AM       omeprazole 20 MG capsule   Also known as:  PriLOSEC    Take 1 capsule (20 mg total) by mouth daily before breakfast.   Last time this was given:  *****/*****/*****  8:49 AM       polyethylene glycol 17 gram packet   Also known as:  GLYCOLAX    Take 17 g by mouth daily as needed (severe constipation).       senna 8.6 mg tablet   Also known as:  SENOKOT    Take 2 tablets by mouth nightly.   Last time this was given:  *****/*****/*****  9:01 PM       sertraline 25 MG tablet   Also known as:  ZOLOFT    Take 1 tablet (25 mg total) by mouth daily.   Last time this was given:  *****/*****/*****  8:49 AM         CHANGE how these medications are taken       Dose, Frequency, and Details    memantine 10 MG tablet   Also known as:  NAMENDA    Dose: 10 MG; Form:  Take  1 TABLET; Route: PO; Frequency: BID; Directions: Not available; Details: Dispense: 180 Tablet(s); Date: *****/*****/*****   What changed:  Another medication with the same name ***** *****. Continue taking this medication, and follow the directions you see here.   Last time this was given:  *****/*****/*****  8:48 AM         CONTINUE taking these medications       Dose, Frequency, and Details    donepezil 10 MG tablet   Also known as:  ARICEPT    Take 1 tablet by mouth daily.   Last time this was given:  *****/*****/*****  9:01 PM       LORazepam 0.5 MG tablet   Also known as:  ATIVAN    Take 1 tablet (0.5 mg total) by mouth every 6 (six) hours as needed for anxiety.                 Immunizations Administered for This Admission     Name *****    Influenza 
Quadrivalent PF IM  Deferred (Patient Refused)    Pneumococcal polysaccharide PPSV23  Deferred (Patient Refused)             Hospital Care Team   Service: Neurosurgery  Inpatient Attending: ***** ***** *****, MD     Attending ***** *****: (*****)*****-*****  Discharge Unit: ***** *****  Primary Care Physician: ***** ***** *****, MD  *****-*****-*****        Transitional Plan   Scheduled appointments:  Appointments Scheduled for Next 90 Days     ***** *****, ***** 10:30 AM *****   (Arrive by 10:15 AM)   Suture with ***** ***** *****, *****   ***** Neurosurgery (--)    ***** ***** *****  ***** ***** *****  ***** ***** *****   *****-*****-*****            ***** *****, *****  2:***** ***** *****   ***** ***** ***** ***** *****   ***** *****, ***** ***** (***** ***** ***** (*****))    ***** ***** *****  ***** ***** *****   *****-*****-*****           *****If you are having a CT Abdomen/Pelvis in addition to this CT exam please arrive 1 hour before your scheduled time to drink oral contrast. Some exams may require additional oral contrast at the time of the exam.*****  Please refer to the CT Abdomen/Pelvis instruction sheet for additional information.  Please check in ***** ***** 20 minutes prior to your scheduled exam time. You should not eat solid foods for two hours prior to your test. Please drink plenty of fluids such as water, clear soups, juice, or black ***** coffee or tea.  Medications: If you need to take your medication in the morning prior to the scan, take it with water. If you take any oral diabetic medications you may not be able to take these medications for 48 hours after receiving intravenous contrast, (x-ray dye) from your CT scan examination. Please consult your prescribing physician to answer any questions about substitute medications that may be necessary. You will receive specific instructions at the time of the exam.  What to wear: Wear loose-fitting, comfortable clothes with no metal (zippers, under wire *****, etc) for the test. Leave your watch, jewelry, and other valuables 
at home.  Other Information: If ***** ever had an allergic reaction to contrast tell your doctor and the technologist. The doctor may prescribe special medicine for you to take before the exam and also while you are here for the exam. You should bring the last dose of medicine with you prior to the scan.  Children who are not patients are not allowed to enter the scan room. Please make alternative arrangements for them or have another adult accompany you to watch your child in the ***** ***** ***** you are having your scan.            ***** *****, ***** 10:45 AM *****   (Arrive by 10:30 AM)   Follow Up with ***** ***** *****, MD   ***** Neurosurgery ***** ***** (--)    ***** ***** *****  ***** *****  ***** ***** *****   *****-*****-*****                 Follow-Up Services            ***** VALLEY HEALTH CENTER   Specialty:  Skilled Nursing Facility    ***** ***** *****  ***** ***** *****   Phone:  *****-*****-*****                 Signed Discharge Orders     Ordered        *****/*****/***** 1526  Activity as tolerated         *****/*****/***** 1526  Discharge diet     Question:  Diet Type  Answer:  Regular       *****/*****/***** 1526  For immediate questions regarding your hospitalization, your medications, and any pending test results please contact your doctor in the hospital: ***** ***** *****, MD at (*****)*****-*****.     Comments:  For immediate questions regarding your hospitalization, your medications, and any pending test results please contact your doctor in the hospital: ***** ***** *****, MD at (*****)*****-*****.           Additional Patient Instructions     WOUND CARE:  -You or a family member should inspect your wound every day and report any of the following problems to your physician (increased redness, drainage, foul odor, or other changes concerning to you).   -Keep your incision clean and dry.  -You may wash your hair with a mild shampoo 4 days after surgery.  -Do NOT apply any lotions, ointments or other products to your incision.     -Do not lift objects over 
10 pounds until approved by your physician.    DIET  -Usually no special diet is prescribed after a craniotomy. A normal well balanced diet is recommended for recovery, and you should resume any specially prescribed diet you were eating before your surgery.  Be sure however, to remain well hydrated, and increase your consumption of fiber, as pain medications may cause constipation.     MEDICATIONS:  -Take all of your medications as ordered.  You do not have to take pain medication unless it is needed.  It is important that you are able to cough, breathe deeply, and is comfortable enough to walk.     -Do not use alcohol while taking pain medication.    -Take an over the counter stool softener for constipation (Colace or Docusate). If you become constipated, try products such as Dulcolax, Milk of Magnesia, first, and then Magnesium Citrate or ***** enema if needed). Often times, pain medication and anesthesia can cause constipation.  -You have been prescribed an anti-seizure medication. Continue to take this until you are told to discontinue by your physician.   -If you were on a medication such as Coumadin (Warfarin), or Plavix (clopidogrel), or Aspirin, prior to your surgery, you may safely resume taking this on *****.  - Please do not start taking any NSAIDs (Ibuprofen, Aleve, Advil, etc.) prior to discussion with your surgeon.   -If you are being sent home on steroid medication, make sure you are taking a medication to protect your stomach (Prilosec, Protonix, or Pepcid), as these medications can cause stomach irritation.  Make sure to take your steroid medication with meals, or a glass of milk.     ACTIVITY:  The first few weeks after you are discharged you may feel tired or fatigued. This is normal. You should become a little stronger every day. Activity is the most important measure you can take to prevent complications and to begin to feel like yourself again. In general:  -Follow the activity 
instructions given to you by your doctor and therapist.  -Increase your activity slowly.  -You may resume sexual activity as your tolerance allows.  -If you feel light headed or fatigued after increasing activity, rest, decrease the amount of activity that you do, and begin building your tolerance to activity more slowly.  -Do not lift objects over 10 pounds until approved by your physician.  -Avoid any activity that causes you to hold your breath and push, for example weight lifting, lifting or moving heavy objects, or straining at stool.  -Do your breathing exercises every two hours.    -Use your incentive spirometer 10 times every hour that you are awake.      WHEN TO CALL YOUR SURGEON:  With any surgery there are risks of complications. Although your surgery is over, there is the possibility of some of these complications developing. These complications include: infection, blood clots, or neurological changes. Call your Physician Immediately if you Experience:  -Confusion, fainting, blacking out, extreme fatigue, memory loss, or difficulty speaking.  -*****, or blurred vision. Loss of vision, either partial or total.  -Hallucinations  -Numbness, tingling, or weakness in your extremities or face.  -***** neck, and/or a fever of 101.***** or more.  -Severe sensitivity to light. (Photophobia)  -Severe headache or change in headache.  -Seizure  -Problems controlling your bowels or bladder.  -Productive cough with yellow or green sputum.  -Swelling, redness, or tenderness in your calf or thigh.  Important Instructions Regarding Emergencies and After-Hour Calls If you have what you feel is a true emergency at any time, please present immediately to your local emergency room, where a doctor there will evaluate you and contact us if needed. Due to the complexity of neurosurgical procedures and treatment of neurosurgical problems, effective advice regarding emergency situations cannot be given over the telephone.         
            Exam   Temperature: 36.4 C (97.6 F) (*****/*****/***** 1512) | Heart Rate: 77 (*****/*****/***** 1512) | BP: 97/62 (*****/*****/***** 1512) | Respiratory Rate: 18 (*****/*****/***** 1512)  | SpO2: 97 % (*****/*****/***** 1512)  O2 Device: None (Room air) (*****/*****/***** 1512)  O2 Flow Rate (L/min): 6 |        Weight: 90.6 kg (199 lb 11.8 oz) (*****/*****/***** 2321)  Height: 178 cm (5' 10.08"") (*****/*****/***** 2321)         BMI (Calculated): 28.6 (*****/*****/***** 2321)    Discharge Exam    Significant Discharge Exam Findings:  Exam at the time of discharge: Wide awake, alert, oriented to name. PERRL. Following commands x 4 today.               Orientation Level: Confused   Cognition: Unable to follow commands         Speech: Expressive Aphasia     Vision: Functional with Correction  Hearing: Functional   Assistive Devices: None         Data/Results    Results are shown for the following tests if performed (CBC, Na, K, BUN, Cr).   If the patient did not have any of these tests, no results will be shown here.  Lab Results   Component Value Date/Time    WBC 9.58 *****/*****/***** *****    HCT 37.6 (L) *****/*****/***** *****    HGB 12.6 (L) *****/*****/***** *****    PLT 271 *****/*****/***** *****      Lab Results   Component Value Date/Time    BUN 20 *****/*****/***** *****    CRE 0.90 *****/*****/***** *****    ***** 3.9 *****/*****/***** *****    ***** ***** *****/*****/***** *****                            "
