BDSPPatientID,annot,y_pred,NoteContent
119906019,0,1,"  Physician ***** *****       Admit date: *****/*****/*****      Discharge date: *****/*****/*****    Patient Information   ***** *****, ***** y.o. male (DOB = *****/*****/*****)    Home Address: ***** ***** *****  ***** ***** *****  Home Phone: *****-*****-***** (home)     What language do you prefer to use when discussing your healthcare?: English  What language do you prefer for written communication?: English    Type of Advance Care Directive(s): Health Care Proxy   Surrogate Decision ***** Name: ***** *****            Care Plan *****: ***** *****       Code Status at *****: Full Code (Presumed)       Discharge address same as *****: No                   Hospitalization Summary     Admission Diagnosis     Hydrocephalus [*****.9]               Principal Problem:    Hydrocephalus  Resolved Problems:    ***** No resolved hospital problems. *****          Surgical (OR) Procedures:   Surgeries this Admission     Past Procedures (*****/*****/***** to Today)       Date Procedures Providers     *****/*****/***** Placement Shunt Ventricular Peritoneal *****, ***** *****              ***** this Admission     Procedure/Test Authorizing Provider    IR IVC ***** Placement ***** ***** *****, MD        Non (OR) Procedures:        Items for Post-Hospitalization Follow-Up:    Patient should hold ASA 1 week, and follow up with Vascular medicine to restart Coumadin. No need to restart the Plavix.     Patient will follow up with vascular medicine in 4-6 weeks for anticoagulation management.     Patient should be seen within 1-2 weeks for suture removal with Dr. *****.           Pending Results     Procedure Component Value Ref Range Date/Time    Culture with Gram stain, CSF [*****] Collected:  *****/*****/***** 1712    Lab Status:  Preliminary result Specimen:  Cerebrospinal Fluid from ***** ***** *****:  *****/*****/***** 0752     Specimen Source/ Description CSF CSF     SPECIAL REQUESTS None     GRAM STAIN Rare *****     GRAM STAIN NO EPITHELIAL CELLS     GRAM STAIN NO ORGANISMS SEEN    
 CULTURE / TEST NO GROWTH 4 DAYS     REPORT STATUS PENDING           Hospital Course   ***** PREVIOUSLY on ASA/Plavix for PVD (Left ***** open bypass 2010 in ***** - by pt report), and coumadin for DVT of the left leg (2 years ago) found to have INR 4.2 with ***** taken for emergent OR for R SDH evac on the day of direct transfer *****/*****/*****. Postop he was taken back the same day emergently for evacuation of R IPH for a venous infarct. His hospital course was complicated seizures for which he was put on keppra 750BID. ASA/Plavix was held for 1 month postop.     Now he returns for Right sided Headaches persisting since surgery, *****, imaging . Head CT shows resolving postop changes and stable subdural collections without acute hemorrhage. However, it also shows enlarged ventricles compared to his postop CTA on *****/*****/***** (which, of note showed IVH) that could potentially represent developing communicating hydrocephalus. Patient was admitted under the care of Dr. ***** for a VPS placement on *****/*****/*****.      Patient was admitted to the Neurosurgical Service on *****/*****/*****  for a ***** shunt placement with Dr. *****.  Patient was taken to the operating room on the day of admission and underwent an uncomplicated procedure. Please see Dr. *****'s separately dictated operative note for details. Post-operatively patient was extubated and transferred to the Neurosurgical ICU for close monitoring. He remained hemodynamically stable, neurologically at baseline, and with his pain well-controlled throughout his hospital stay. On POD#1 he was transferred to the floor in stable condition and was deemed ready for discharge on Post Op Day #3 to Rehab.    NEURO: Patient remained neurologically at baseline throughout his hospital stay. A+O x 3, EOMI, PERRL, FS, TM, sensation grossly intact, LLE *****/*****, ***** 4+/5, which is stable from preop, no drift. Post op imaging showed no complications over surgical regions.  He will continue 
home dose of Keppra 1,500 BID, and Vimpat ***** *****.     CV: Hemodynamically stable at all times.    RESP: Patient became hypoxic on POD#2, and had new O2 requirement, He was sent for lower extremity ultrasound and CT PE which was positive for L proximal peroneal DVT and PE.      GU: Voiding on his own after foley removed with no signs of retention or UTI.    GI: Tolerating a regular diet with no nausea or vomiting.    HEME: SQH and SCDs for DVT prophylaxis. He Received IVC filter on *****/*****/***** for DVT/PE found postop. Should hold ASA 1 week, and follow up with Vascular medicine to restart Coumadin. No need to restart the Plavix.     ID: ***** at all times. Perioperative ABX. Incision remained clean, dry, and intact with no evidence of erythema, warmth, or hematoma.    *****: Ambulating on his own and feels ready to go home with no services needed. At the time of discharge his pain remained well controlled on oral medications. Patient will follow up with Dr. ***** in 1-2 weeks.           Medications   Allergies: Review of patient's allergies indicates no known allergies.    Prior to Admission Medications   Prescriptions   FLUoxetine (PROZAC) 20 MG capsule   Sig: Take 1 capsule (20 mg total) by mouth daily.   MENTHOL (***** COLD THERAPY *****)   Sig: by Topical (*****) route 3 (three) times a day as needed. Apply moderate amount to neck and lumbar spine for ***** pain   QUEtiapine (SEROQUEL) 25 MG tablet   Sig: Take 25 mg by mouth nightly. 12.***** *****   aluminum-magnesium hydroxide-simethicone (MAALOX) *****-*****-***** mg/5 mL Susp   Sig: Take 30 mL by mouth every 4 (four) hours as needed.   bisacodyl (DULCOLAX) 10 mg suppository   Sig: Place 10 mg rectally daily as needed.   docusate sodium (COLACE) 100 MG capsule   Sig: Take 100 mg by mouth 2 (two) times a day as needed for constipation.   lacosamide (VIMPAT) 100 mg Tab   Sig: Take 1 tablet (100 mg total) by mouth 2 (two) times a day.   levETIRAcetam (KEPPRA) 750 MG 
tablet   Sig: Take 2 tablets (1,500 mg total) by mouth 2 (two) times a day.   magnesium hydroxide (MOM) 400 mg/5 mL Susp   Sig: Take 30 mL by mouth nightly as needed.   oxyCODONE 5 MG immediate release tablet   Sig: Take 1 tablet (5 mg total) by mouth every 6 (six) hours as needed for moderate pain. Partial fill ok at patient request.   senna (SENOKOT) 8.6 mg tablet   Sig: Take 2 tablets by mouth nightly as needed for constipation.   traZODone (DESYREL) 50 MG tablet   Sig: Take 50 mg by mouth nightly as needed.      Facility-Administered Medications: None        Discharge Medications      STOP taking these medications          oxyCODONE 5 MG immediate release tablet         START taking these medications       Dose, Frequency, and Details    acetaminophen 325 mg tablet   Also known as:  TYLENOL    Take 2 tablets (650 mg total) by mouth every 4 (four) hours as needed for mild pain or fever.   Last time this was given:  *****/*****/***** 10:59 AM       heparin 5,000 unit/mL injection    Inject 1 mL (5,000 Units total) under the skin every 8 (eight) hours.   Last time this was given:  *****/*****/*****  5:07 AM       traMADol 50 mg tablet   Also known as:  ULTRAM    Take 1 tablet (50 mg total) by mouth every 6 (six) hours as needed.   Last time this was given:  *****/*****/***** 10:59 AM         CONTINUE taking these medications       Dose, Frequency, and Details    aluminum-magnesium hydroxide-simethicone *****-*****-***** mg/5 mL Susp   Also known as:  MAALOX    Take 30 mL by mouth every 4 (four) hours as needed.       ***** COLD THERAPY *****    by Topical (*****) route 3 (three) times a day as needed. Apply moderate amount to neck and lumbar spine for ***** pain       bisacodyl 10 mg suppository   Also known as:  DULCOLAX    Place 10 mg rectally daily as needed.       docusate sodium 100 MG capsule   Also known as:  COLACE    Take 100 mg by mouth 2 (two) times a day as needed for constipation.   Last time this was given:  *****/*****/*****  8:24 
AM       FLUoxetine 20 MG capsule   Also known as:  PROzac    Take 1 capsule (20 mg total) by mouth daily.   Last time this was given:  *****/*****/*****  8:24 AM       lacosamide 100 mg Tab   Also known as:  VIMPAT    Take 1 tablet (100 mg total) by mouth 2 (two) times a day.   Last time this was given:  *****/*****/*****  8:24 AM       levETIRAcetam 750 MG tablet   Also known as:  KEPPRA    Take 2 tablets (1,500 mg total) by mouth 2 (two) times a day.   Last time this was given:  *****/*****/*****  8:24 AM       magnesium hydroxide 400 mg/5 mL Susp   Also known as:  MOM    Take 30 mL by mouth nightly as needed.       QUEtiapine 25 MG tablet   Also known as:  SEROquel    Take 25 mg by mouth nightly. 12.***** *****   Last time this was given:  *****/*****/***** 11:13 PM       senna 8.6 mg tablet   Also known as:  SENOKOT    Take 2 tablets by mouth nightly as needed for constipation.       traZODone 50 MG tablet   Also known as:  DESYREL    Take 50 mg by mouth nightly as needed.                        Hospital Care Team   Service: Neurosurgery  Inpatient Attending: ***** ***** *****, MD     Attending ***** *****: (*****)*****-*****  Discharge Unit: *****  Primary Care Physician: ***** *****. *****, MD  *****-*****-*****        Transitional Plan   Scheduled appointments:  Appointments Scheduled for Next 90 Days     ***** *****, *****  8:30 AM *****   NEW PATIENT with ***** ***** *****, MD   ***** Vascular Medicine (--)    ***** ***** *****  ***** ***** *****   *****-*****-*****                 Follow-Up Services            ACADEMY ***** ***** ANDOVER   Specialty:  Skilled Nursing Facility    ***** ***** *****  ***** ***** *****   Phone:  *****-*****-*****                 Signed Discharge Orders     Ordered        *****/*****/***** 1248  Activity as tolerated         *****/*****/***** 1248  Discharge diet     Question:  Diet Type  Answer:  Regular       *****/*****/***** 1248  For immediate questions regarding your hospitalization, your medications, and any pending test results please contact your doctor in the 
hospital: ***** ***** *****, MD at (*****)*****-*****.     Comments:  For immediate questions regarding your hospitalization, your medications, and any pending test results please contact your doctor in the hospital: ***** ***** *****, MD at (*****)*****-*****.       *****/*****/***** 1248  Reason for not ordering smoking cessation medication(s)     Question:  Reason for not ordering medication(s):  Answer:  No tobacco cessation medication(s): medically contraindicated  Comment:  Allow for healing of surgical site           Additional Patient Instructions     Please resume all your home medications except blood thinners (no aspirin, motrin, ibuprofen) unless otherwise instructed by your surgeon.  Please take pain medications only as needed for pain. Tylenol in addition to prescribed narcotics may help for severe pain. Please do not drive, operate machinery, or drink alcohol while taking narcotic pain medications.     Please do not lift heavy weights (>20 lbs) for one month. No exercise or strenuous activity until after your follow-up appointment.    Please call Dr. *****'s office to schedule your follow up appointment.  You should be seen within 1-2 weeks for suture removal.      If you need to reach Dr. *****'s office during normal business hours, M-F 8am-5pm, please call the phone numbers listed in this order:  1. *****-*****-***** (Administrative assistant ***** *****)  2. *****-*****-***** (***** *****, *****-C)    If you are unable to reach someone at the above numbers or it is not during business hours please call:  *****-*****-*****, ***** ***** ***** paged, the Neurosurgery resident on call.  If you do not receive a call back from the Neurosurgery resident on call, ***** ***** ***** paged.    Please do not get your incision wet until after sutures are removed at follow-up. It is OK to shower but keep incision dry.  Incision must be covered when showering, and the dressing or shower cap may be removed after showering.    Please call your MD immediately or 
go to the Emergency Department if the following symptoms occur: headaches, neck pain, fever, chills, nausea, vomiting, diarrhea, worsening weakness, numbness, visual changes, chest pain, shortness of breath, or any other symptoms of your concern.    Return to the Emergency Department or see your own doctor right away if any problems develop, including the following:  --Fever >101 F or shaking chills.  --Purulent discharge (pus) from wound, or any increased drainage.  --Increased redness or swelling around the wound.  --Worsening Headache or Neck Stiffness.  --Seizures or any loss of consciousness, dizziness, or fainting.  --Blurry vision, double vision, or eye irritation.  --Nausea or vomiting.  --Chest or back pain, or shortness of breath.    PLEASE REMEMBER: It is OK to shower but do NOT get incision wet.  Incision must be covered when showering and dressing may be removed after showering.  No driving while taking pain medication.  Avoid strenuous activity until follow-up appointment, at least.  Call office or come to ER if: fever>101, increasing pain/headache, increasing nausea/vomiting, signs of wound infection (increasing pain, redness, warmth, swelling, or discharge), new or worsening neurologic deficit, or anything else that is ***** to you. Sutures will be removed in clinic.                           Exam   Temperature: 36.7 C (98 F) (*****/*****/***** 0747) | Heart Rate: 87 (*****/*****/***** 0900) | BP: 98/56 (*****/*****/***** 0747) | Respiratory Rate: 20 (*****/*****/***** 0747)  | SpO2: 90 % (*****/*****/***** 0900)  O2 Device: None (Room air) (off O2) (*****/*****/***** 0900)  O2 Flow Rate (L/min): 3  O2 Flow Rate (mL/min): 6 |        Weight: 65.8 kg (145 lb) (*****/*****/***** 1137)  Height: 167.6 cm (5' 6"") (*****/*****/***** 1137)         BMI (Calculated): 23.4 (*****/*****/***** 1137)    Discharge Exam    Significant Discharge Exam Findings:  Alert, Awake, Oriented to Name, Year, and *****  ***** movements are intact, tongue midline, left nasolabial fold 
flattening  No pronator drift  Right side: full strength  Left side: *****/*****  Incision clean, dry, and intact              Orientation Level: Oriented X7   Cognition: Follows commands         Speech: Clear     Vision: Functional  Hearing: Functional   Assistive Devices: None         Data/Results    Results are shown for the following tests if performed (CBC, Na, K, BUN, Cr).   If the patient did not have any of these tests, no results will be shown here.  Lab Results   Component Value Date/Time    WBC 11.13 (H) *****/*****/***** *****    HCT 35.2 (L) *****/*****/***** *****    ***** 12.0 (L) *****/*****/***** *****    HGB 11.3 (L) *****/*****/***** *****    PLT 313 *****/*****/***** *****      Lab Results   Component Value Date/Time    BUN 9 *****/*****/***** *****    CRE 0.62 *****/*****/***** *****    ***** 4.5 *****/*****/***** *****    ***** ***** *****/*****/***** *****                            "
